{
  "$schema": "https://json-schema.org/draft/2020-12/schema",
  "$id": "contracts/control-center/v1/job-status.response.schema.json",
  "title": "job-status.response",
  "type": "object",
  "required": [
    "job_id",
    "tenant_id",
    "correlation_id",
    "idempotency_key",
    "operation",
    "state",
    "actor",
    "target",
    "created_at",
    "updated_at"
  ],
  "additionalProperties": false,
  "properties": {
    "job_id": {
      "type": "string",
      "pattern": "^[A-Za-z0-9_.:-]{1,128}$"
    },
    "tenant_id": {
      "type": "string",
      "pattern": "^[A-Za-z0-9_.:-]{1,128}$"
    },
    "correlation_id": {
      "type": "string",
      "pattern": "^[A-Za-z0-9_.:-]{1,128}$"
    },
    "idempotency_key": {
      "type": "string",
      "pattern": "^[A-Za-z0-9_.:-]{8,256}$"
    },
    "operation": {
      "type": "string",
      "enum": [
        "preflight",
        "install",
        "configure",
        "start",
        "stop",
        "restart",
        "update",
        "status",
        "backup",
        "restore",
        "rollback"
      ]
    },
    "state": {
      "type": "string",
      "enum": [
        "queued",
        "approved",
        "running",
        "succeeded",
        "failed",
        "cancelled",
        "expired",
        "rolled_back"
      ]
    },
    "actor": {
      "type": "object",
      "required": [
        "type",
        "id"
      ],
      "additionalProperties": false,
      "properties": {
        "type": {
          "type": "string",
          "enum": [
            "user",
            "service"
          ]
        },
        "id": {
          "type": "string",
          "pattern": "^[A-Za-z0-9_.:-]{1,128}$"
        }
      }
    },
    "target": {
      "type": "object",
      "required": [
        "server_id"
      ],
      "additionalProperties": false,
      "properties": {
        "server_id": {
          "type": "string",
          "pattern": "^[A-Za-z0-9_.:-]{1,128}$"
        },
        "deployment_id": {
          "type": "string",
          "pattern": "^[A-Za-z0-9_.:-]{1,128}$"
        }
      }
    },
    "created_at": {
      "type": "string",
      "pattern": "^\\d{4}-\\d{2}-\\d{2}T\\d{2}:\\d{2}:\\d{2}Z$"
    },
    "updated_at": {
      "type": "string",
      "pattern": "^\\d{4}-\\d{2}-\\d{2}T\\d{2}:\\d{2}:\\d{2}Z$"
    },
    "error": {
      "type": [
        "object",
        "null"
      ],
      "required": [
        "code",
        "message"
      ],
      "additionalProperties": false,
      "properties": {
        "code": {
          "type": "string"
        },
        "message": {
          "type": "string"
        },
        "retryable": {
          "type": "boolean"
        }
      }
    },
    "evidence": {
      "type": "object"
    }
  }
}
